{
  "summary": "Bridge clear at checkpoint α",
  "priority": "immediate",
  "net_id": "01JAZ6F4N6R7T8V9W0X1Y2Z3A4",
  "kind": "report",
  "id": "01JAZ6G5P7Q8R9S0T1V2W3X4Y5",
  "extensions": {},
  "details": "Two lanes passable",
  "created_at_ms": 1735689600123,
  "confidence": 90,
  "author": "styrene:identity:alpha"
}
